{
  "id": "hikvision-ds-2cd2123g2-iu",
  "brand": "Hikvision",
  "model": "DS-2CD2123G2-I(U)",
  "type": "dome",
  "connectivity": [
    "ethernet"
  ],
  "release_year": 2021,
  "resolution": {
    "megapixels": 2,
    "label": "1080p HD"
  },
  "field_of_view_deg": "103h",
  "night_vision": {
    "type": "ir",
    "range_m": 40
  },
  "power": {
    "method": "PoE (802.3af) / DC 12V"
  },
  "storage": {
    "onboard": true,
    "max_microsd_gb": 256,
    "nvr_compatible": true,
    "cloud": false
  },
  "protocols": [
    "onvif",
    "rtsp"
  ],
  "ip_rating": "IP67",
  "audio": {
    "microphone": false,
    "speaker": false,
    "two_way": false
  },
  "features": [
    "2MP AcuSense Gen2 vandal dome",
    "human/vehicle detection",
    "40m IR",
    "130dB WDR",
    "H.265+",
    "IP67",
    "IK10"
  ],
  "sources": [
    "https://www.hikvision.com/en/products/"
  ],
  "power_source": [
    "poe",
    "dc"
  ],
  "configs": {
    "frigate": {
      "detect": {
        "width": 640,
        "height": 480,
        "fps": 5
      },
      "rtsp_url_template": "rtsp://{user}:{pass}@{ip}:554/Streaming/Channels/101",
      "best_substream": "rtsp://{user}:{pass}@{ip}:554/Streaming/Channels/102"
    },
    "home_assistant": {
      "integration": "onvif",
      "notes": "Use ONVIF integration. Default ONVIF port 80. Enable in Configuration > Network > Integration Protocol."
    },
    "blue_iris": {
      "profile": "Hikvision",
      "notes": "Select 'Hikvision' profile. Use main stream for recording, sub stream for live view."
    }
  }
}
