{
  "id": "hanwha-pnd-a9300rp",
  "brand": "Hanwha",
  "model": "PND-A9300RP",
  "type": "dome",
  "connectivity": [
    "ethernet"
  ],
  "release_year": 2024,
  "resolution": {
    "megapixels": 4,
    "label": "4MP"
  },
  "field_of_view_deg": "107h",
  "night_vision": {
    "type": "ir",
    "range_m": 40
  },
  "power": {
    "method": "PoE (802.3af)"
  },
  "storage": {
    "onboard": true,
    "max_microsd_gb": 256,
    "nvr_compatible": true,
    "cloud": false
  },
  "protocols": [
    "onvif",
    "rtsp"
  ],
  "ip_rating": "IP42",
  "audio": {
    "microphone": false,
    "speaker": false,
    "two_way": false
  },
  "features": [
    "Wisenet P indoor dome AI analytics",
    "face recognition",
    "WiseAI",
    "IP42",
    "IK10",
    "NDAA"
  ],
  "sources": [
    "https://hanwhavisionamerica.com/"
  ],
  "power_source": [
    "poe"
  ],
  "configs": {
    "frigate": {
      "detect": {
        "width": 1280,
        "height": 720,
        "fps": 5
      },
      "rtsp_url_template": "rtsp://{user}:{pass}@{ip}:554/profile1/media.smp",
      "best_substream": "rtsp://{user}:{pass}@{ip}:554/profile2/media.smp"
    },
    "home_assistant": {
      "integration": "onvif",
      "notes": "Use ONVIF integration. Default ONVIF port 80."
    },
    "blue_iris": {
      "profile": "Samsung/Hanwha",
      "notes": "Select 'Samsung' or 'Hanwha' profile depending on Blue Iris version."
    }
  }
}
