{
  "id": "annke-c800-poe-b",
  "brand": "Annke",
  "model": "C800 PoE Bullet",
  "type": "bullet",
  "connectivity": [
    "ethernet"
  ],
  "release_year": 2022,
  "resolution": {
    "megapixels": 8,
    "label": "4K UHD"
  },
  "field_of_view_deg": "107h",
  "night_vision": {
    "type": "ir",
    "range_m": 30
  },
  "power": {
    "method": "PoE / DC 12V"
  },
  "storage": {
    "onboard": true,
    "max_microsd_gb": 256,
    "nvr_compatible": true,
    "cloud": false
  },
  "protocols": [
    "onvif",
    "rtsp"
  ],
  "ip_rating": "IP67",
  "audio": {
    "microphone": false,
    "speaker": false,
    "two_way": false
  },
  "features": [
    "Annke C800 4K PoE outdoor bullet",
    "30m IR",
    "H.265+",
    "ONVIF/RTSP",
    "IP67",
    "no subscription",
    "Blue Iris compatible"
  ],
  "sources": [
    "https://www.annke.com/"
  ],
  "power_source": [
    "poe",
    "dc"
  ]
}
