{
  "id": "hilook-ipc-d140ha-lu",
  "brand": "HiLook",
  "model": "IPC-D140HA-LU",
  "aliases": [
    "HiLook 4MP ColorVu Lite Dome by Hikvision"
  ],
  "type": "dome",
  "connectivity": [
    "ethernet"
  ],
  "release_year": 2024,
  "resolution": {
    "megapixels": 4,
    "max_width": 2560,
    "max_height": 1440,
    "label": "4MP"
  },
  "sensor": "CMOS",
  "lens": {
    "count": 1,
    "focal_length_mm": "2.8 (fixed)",
    "aperture": "F1.6",
    "varifocal": false
  },
  "field_of_view_deg": "107 horizontal",
  "night_vision": {
    "type": "color",
    "range_m": 20
  },
  "power": {
    "method": "PoE (802.3af) / DC 12V"
  },
  "storage": {
    "onboard": true,
    "max_microsd_gb": 256,
    "nvr_compatible": true,
    "cloud": false
  },
  "protocols": [
    "onvif",
    "rtsp"
  ],
  "ip_rating": "IP67",
  "audio": {
    "microphone": true,
    "speaker": false,
    "two_way": false
  },
  "features": [
    "HiLook ColorVu Lite 4MP full-color dome",
    "F1.6 warm light night vision 20m",
    "Motion Detection 2.0 human/vehicle",
    "built-in mic",
    "H.265+",
    "ONVIF/RTSP",
    "IP67",
    "Hikvision NVR compatible"
  ],
  "msrp_usd": 55,
  "sources": [
    "https://www.hikvision.com/en/products/HiLook-IP-Products/"
  ],
  "power_source": [
    "poe",
    "dc"
  ]
}
