{
  "id": "dahua-ipc-hfw3849e-as-led-4k",
  "brand": "Dahua",
  "model": "IPC-HFW3849E-AS-LED",
  "aliases": [
    "WizSense 8MP Full-Color Warm LED Bullet"
  ],
  "type": "bullet",
  "connectivity": [
    "ethernet"
  ],
  "resolution": {
    "megapixels": 8,
    "max_width": 3840,
    "max_height": 2160,
    "label": "4K UHD"
  },
  "sensor": "1/2.7\" CMOS",
  "lens": {
    "count": 1,
    "focal_length_mm": "2.8 / 3.6 (fixed)",
    "varifocal": false
  },
  "night_vision": {
    "type": "color",
    "range_m": 30
  },
  "power": {
    "method": "PoE / DC 12V"
  },
  "storage": {
    "onboard": true,
    "max_microsd_gb": 256,
    "nvr_compatible": true,
    "cloud": false
  },
  "protocols": [
    "onvif",
    "rtsp"
  ],
  "ip_rating": "IP67",
  "audio": {
    "microphone": true,
    "speaker": false,
    "two_way": false
  },
  "features": [
    "full-color warm LED night vision",
    "WizSense AI human/vehicle",
    "H.265+",
    "built-in mic"
  ],
  "sources": [
    "https://www.dahuasecurity.com"
  ],
  "power_source": [
    "poe",
    "dc"
  ]
}
