{
  "id": "avigilon-h6sl-bo1-ir-5mp",
  "brand": "Avigilon",
  "model": "H6SL 5MP Bullet (5.0C-H6SL-BO1-IR)",
  "aliases": [
    "5.0C-H6SL-BO1-IR"
  ],
  "type": "bullet",
  "connectivity": [
    "ethernet"
  ],
  "resolution": {
    "megapixels": 5,
    "max_width": 2592,
    "max_height": 1944,
    "label": "5MP"
  },
  "sensor": "1/2.8\" CMOS",
  "lens": {
    "count": 1,
    "focal_length_mm": "3.3-9 (motorized varifocal)",
    "varifocal": true
  },
  "field_of_view_deg": "97-33 horizontal",
  "night_vision": {
    "type": "ir",
    "range_m": 40
  },
  "power": {
    "method": "PoE (802.3af)"
  },
  "storage": {
    "onboard": true,
    "nvr_compatible": true,
    "cloud": true
  },
  "protocols": [
    "onvif",
    "rtsp"
  ],
  "ip_rating": "IP66",
  "audio": {
    "microphone": false,
    "speaker": false,
    "two_way": false
  },
  "features": [
    "Avigilon Next-Gen Video Analytics",
    "Appearance Search",
    "LightCatcher",
    "HDSM SmartCodec",
    "H.265",
    "IK10",
    "H6SL Slim Line series"
  ],
  "sources": [
    "https://www.avigilon.com/"
  ],
  "power_source": [
    "poe"
  ],
  "configs": {
    "frigate": {
      "detect": {
        "width": 1280,
        "height": 720,
        "fps": 5
      },
      "rtsp_url_template": "rtsp://{user}:{pass}@{ip}:554/defaultPrimary?streamType=u"
    },
    "home_assistant": {
      "integration": "onvif",
      "notes": "Use ONVIF integration."
    }
  }
}
