{
  "id": "reolink-rlc-840wa",
  "brand": "Reolink",
  "model": "RLC-840WA",
  "type": "turret",
  "connectivity": [
    "wifi",
    "ethernet"
  ],
  "resolution": {
    "megapixels": 8,
    "max_width": 3840,
    "max_height": 2160,
    "label": "4K UHD"
  },
  "sensor": "1/2.8\" CMOS",
  "lens": {
    "count": 1,
    "focal_length_mm": "2.8 (fixed)",
    "aperture": "F2.0",
    "varifocal": false
  },
  "field_of_view_deg": "125 horizontal",
  "night_vision": {
    "type": "hybrid",
    "range_m": 30
  },
  "power": {
    "method": "DC 12V"
  },
  "storage": {
    "onboard": true,
    "max_microsd_gb": 512,
    "nvr_compatible": true,
    "cloud": false
  },
  "protocols": [
    "onvif",
    "rtsp"
  ],
  "ip_rating": "IP67",
  "audio": {
    "microphone": true,
    "speaker": true,
    "two_way": true
  },
  "features": [
    "dual-band WiFi 6 (802.11ax)",
    "spotlight color night vision",
    "IK10 vandal resistant",
    "person/vehicle/animal detection",
    "no subscription"
  ],
  "release_year": 2024,
  "sources": [
    "https://reolink.com/product/rlc-840wa/"
  ],
  "power_source": [
    "dc"
  ],
  "configs": {
    "frigate": {
      "detect": {
        "width": 1280,
        "height": 720,
        "fps": 5
      },
      "rtsp_url_template": "rtsp://{user}:{pass}@{ip}:554/h264Preview_01_main",
      "best_substream": "rtsp://{user}:{pass}@{ip}:554/h264Preview_01_sub"
    },
    "home_assistant": {
      "integration": "reolink",
      "notes": "Native Reolink integration auto-discovers via ONVIF on port 8000."
    }
  }
}
