{
  "id": "axis-m3106-lve-mk-ii",
  "brand": "Axis",
  "model": "M3106-LVE Mk II",
  "aliases": [
    "Axis M3106-LVE Mk II 4MP Outdoor Dome"
  ],
  "type": "dome",
  "connectivity": [
    "ethernet"
  ],
  "resolution": {
    "megapixels": 4,
    "max_width": 2688,
    "max_height": 1520,
    "label": "4MP"
  },
  "sensor": "1/2.7\" Progressive Scan CMOS",
  "lens": {
    "count": 1,
    "focal_length_mm": "3-9 (motorized varifocal)",
    "aperture": "F1.8",
    "varifocal": true
  },
  "field_of_view_deg": "107-36 horizontal",
  "night_vision": {
    "type": "ir",
    "range_m": 30
  },
  "power": {
    "method": "PoE (802.3af)"
  },
  "storage": {
    "onboard": true,
    "nvr_compatible": true,
    "cloud": false
  },
  "protocols": [
    "onvif",
    "rtsp"
  ],
  "ip_rating": "IP66",
  "audio": {
    "microphone": false,
    "speaker": false,
    "two_way": false
  },
  "features": [
    "Forensic WDR",
    "OptimizedIR",
    "H.265 Zipstream",
    "remote zoom and focus",
    "AXIS Video Motion Detection",
    "IK10",
    "affordable mid-range outdoor dome"
  ],
  "sources": [
    "https://www.axis.com/products/axis-m3106-lve-mk-ii"
  ],
  "power_source": [
    "poe"
  ]
}
