{
  "id": "reolink-reolink-go-plus",
  "brand": "Reolink",
  "model": "Go Plus",
  "aliases": [
    "Reolink Go Plus 4G LTE Battery Camera"
  ],
  "type": "bullet",
  "connectivity": [],
  "release_year": 2022,
  "resolution": {
    "megapixels": 4,
    "max_width": 2560,
    "max_height": 1440,
    "label": "4MP QHD"
  },
  "sensor": "CMOS",
  "lens": {
    "count": 1,
    "focal_length_mm": "Fixed",
    "aperture": "F1.8",
    "varifocal": false
  },
  "field_of_view_deg": "119 horizontal",
  "night_vision": {
    "type": "color",
    "range_m": 10
  },
  "power": {
    "method": "Rechargeable battery / solar optional"
  },
  "storage": {
    "onboard": true,
    "max_microsd_gb": 256,
    "nvr_compatible": false,
    "cloud": true
  },
  "protocols": [
    "http"
  ],
  "ip_rating": "IP65",
  "audio": {
    "microphone": true,
    "speaker": true,
    "two_way": true
  },
  "features": [
    "4G LTE cellular (no WiFi required)",
    "4MP QHD",
    "color spotlight night vision",
    "person/vehicle/animal detection",
    "solar optional",
    "no subscription (local microSD)",
    "IP65",
    "works anywhere with cellular signal — farms/remote areas"
  ],
  "msrp_usd": 129,
  "sources": [
    "https://reolink.com/product/reolink-go-plus/"
  ],
  "power_source": [
    "battery",
    "solar"
  ]
}
