{
  "id": "wyze-cam-floodlight-pro",
  "brand": "Wyze",
  "model": "Cam Floodlight Pro",
  "type": "bullet",
  "connectivity": [
    "wifi"
  ],
  "release_year": 2023,
  "resolution": {
    "megapixels": 4,
    "max_width": 2560,
    "max_height": 1440,
    "label": "2.5K QHD"
  },
  "sensor": "CMOS",
  "lens": {
    "count": 1,
    "focal_length_mm": "2.8 (fixed)",
    "aperture": "F1.8",
    "varifocal": false
  },
  "field_of_view_deg": "180 diagonal",
  "night_vision": {
    "type": "color",
    "range_m": 15
  },
  "power": {
    "method": "Hardwired (AC mains)"
  },
  "storage": {
    "onboard": true,
    "max_microsd_gb": 256,
    "nvr_compatible": false,
    "cloud": true
  },
  "protocols": [
    "rtsp"
  ],
  "ip_rating": "IP55",
  "audio": {
    "microphone": true,
    "speaker": true,
    "two_way": true
  },
  "features": [
    "2.5K floodlight camera",
    "180deg wide FOV",
    "3000-lumen floodlight",
    "AI person/pet/vehicle/package detection",
    "motion-activated spotlight",
    "no subscription required",
    "Alexa / Google"
  ],
  "msrp_usd": 149.98,
  "sources": [
    "https://www.wyze.com/products/wyze-cam-floodlight-pro"
  ],
  "power_source": [
    "ac-mains"
  ],
  "configs": {
    "frigate": {
      "detect": {
        "width": 1280,
        "height": 720,
        "fps": 5
      },
      "rtsp_url_template": "rtsp://{user}:{pass}@{ip}/live"
    },
    "home_assistant": {
      "integration": "wyze",
      "notes": "Use wyze_bridge HACS integration for RTSP. Official Wyze firmware does not support RTSP; flash wz_mini_hacks or use Docker bridge."
    },
    "blue_iris": {
      "profile": "Generic/RTSP",
      "notes": "Use Generic/RTSP profile. Requires wz_mini_hacks firmware or wyze-bridge Docker container for RTSP."
    }
  }
}
