{
  "id": "pelco-sarix-professional-4-imp231-1ers",
  "brand": "Pelco",
  "model": "Sarix Professional 4 IMP231-1ERS",
  "type": "bullet",
  "connectivity": [
    "ethernet"
  ],
  "resolution": {
    "megapixels": 2,
    "max_width": 1920,
    "max_height": 1080,
    "label": "1080p"
  },
  "sensor": "1/2.8\" CMOS",
  "lens": {
    "count": 1,
    "focal_length_mm": "3-9",
    "varifocal": true
  },
  "field_of_view_deg": "96-34 horizontal",
  "night_vision": {
    "type": "ir",
    "range_m": 50
  },
  "power": {
    "method": "PoE (IEEE 802.3af)"
  },
  "storage": {
    "onboard": true,
    "max_microsd_gb": 256,
    "nvr_compatible": true,
    "cloud": false
  },
  "protocols": [
    "onvif",
    "rtsp"
  ],
  "ip_rating": "IP67",
  "audio": {
    "microphone": true,
    "speaker": false,
    "two_way": false
  },
  "features": [
    "SureVision WDR",
    "analytics-ready",
    "built-in heater",
    "H.265 compression",
    "smart IR"
  ],
  "release_year": 2021,
  "sources": [
    "https://www.pelco.com/products/sarix-professional/"
  ],
  "power_source": [
    "poe"
  ],
  "configs": {
    "frigate": {
      "detect": {
        "width": 640,
        "height": 480,
        "fps": 5
      },
      "rtsp_url_template": "rtsp://{user}:{pass}@{ip}:554/stream1"
    },
    "home_assistant": {
      "integration": "onvif",
      "notes": "Use ONVIF integration."
    }
  }
}
