{
  "id": "axis-q2101-e",
  "brand": "Axis",
  "model": "Q2101-E Thermal",
  "type": "bullet",
  "connectivity": [
    "ethernet"
  ],
  "release_year": 2021,
  "resolution": {
    "megapixels": 0,
    "max_width": 384,
    "max_height": 288,
    "label": "384×288 thermal"
  },
  "sensor": "Uncooled microbolometer LWIR",
  "lens": {
    "count": 1,
    "focal_length_mm": "10 / 19 / 35 (fixed)",
    "varifocal": false
  },
  "field_of_view_deg": "45 horizontal (10mm)",
  "night_vision": {
    "type": "none",
    "range_m": 0
  },
  "power": {
    "method": "PoE (802.3af)"
  },
  "storage": {
    "onboard": true,
    "nvr_compatible": true,
    "cloud": false
  },
  "protocols": [
    "onvif",
    "rtsp"
  ],
  "ip_rating": "IP66",
  "audio": {
    "microphone": false,
    "speaker": false,
    "two_way": false
  },
  "features": [
    "thermal LWIR outdoor bullet",
    "detects humans in smoke/fog/total darkness",
    "AXIS Object Analytics",
    "Zipstream H.265",
    "IP66",
    "IK10",
    "-20°C to +60°C",
    "perimeter protection / critical infrastructure"
  ],
  "sources": [
    "https://www.axis.com/"
  ],
  "power_source": [
    "poe"
  ],
  "configs": {
    "frigate": {
      "detect": {
        "width": 640,
        "height": 480,
        "fps": 5
      },
      "rtsp_url_template": "rtsp://{user}:{pass}@{ip}/axis-media/media.amp?resolution=1920x1080",
      "best_substream": "rtsp://{user}:{pass}@{ip}/axis-media/media.amp?resolution=640x480"
    },
    "home_assistant": {
      "integration": "axis",
      "notes": "Native Axis integration with auto-discovery via Zeroconf."
    },
    "blue_iris": {
      "profile": "Axis",
      "notes": "Select 'Axis' profile. Auto-discovery via ONVIF usually works."
    }
  }
}
